{
  "id": "bess.skid.v1",
  "version": "1.0.0",
  "subject_kind": "Asset",
  "initial_state": "Installed",
  "states": ["Installed", "ReadyForCommission", "Commissioned"],
  "terminal_states": ["Commissioned"],
  "transitions": [
    {
      "id": "installed_to_ready",
      "from": "Installed",
      "to": "ReadyForCommission",
      "evidence_requirements": [
        { "evidence_type": "CellVoltageInBand", "min_count": 1 },
        { "evidence_type": "InsulationResistanceOk", "min_count": 1 }
      ],
      "dependencies": []
    },
    {
      "id": "ready_to_commissioned",
      "from": "ReadyForCommission",
      "to": "Commissioned",
      "evidence_requirements": [
        { "evidence_type": "ThermalStable", "min_count": 1 }
      ],
      "dependencies": []
    }
  ]
}
